<?xml version="1.0"?>
<?xml-stylesheet type="text/xsl" href="chantey.xsl"?>
<!DOCTYPE chantey SYSTEM "chantey.dtd">
<chantey>
    <title>On the Banks of Sacramento</title>
    <collection>1894BMORCOM</collection>
    <location>61</location>
    <author>
        <personid>Trad</personid>
    </author>
    <ID>R000319</ID>

<text>
As I was walking down the street,
    Hoodah, to my Hoodah;
A charming girl I chanced to meet,
    Hoodah, Hoodah day.

Blow ye wind heigho,
    For California, O;
There's plenty of gold
    So I've been told
On the banks of Sacramento.
</text>

</chantey>

